{
  "$schema": "./config-contract.schema.json",
  "config": {
    "fileName": ".octocoderc",
    "schemaVersion": 1,
    "runtimeSurfaces": [
      "mcp",
      "cli"
    ]
  },
  "environment": {
    "PATH": {
      "dotenv": "never",
      "description": "Executable search path"
    },
    "HOME": {
      "dotenv": "never",
      "description": "Operating-system home"
    },
    "SHELL": {
      "dotenv": "never",
      "description": "Login shell"
    },
    "USER": {
      "dotenv": "never",
      "description": "Operating-system user"
    },
    "LOGNAME": {
      "dotenv": "never",
      "description": "Operating-system login"
    },
    "PWD": {
      "dotenv": "never",
      "description": "Process working directory"
    },
    "TMPDIR": {
      "dotenv": "never",
      "description": "Temporary directory"
    },
    "NODE_OPTIONS": {
      "dotenv": "never",
      "description": "Node process options"
    },
    "PYTHON": {
      "dotenv": "never",
      "description": "Python executable override"
    },
    "GH_TOKEN": {
      "dotenv": "all",
      "tokenPriority": 0,
      "description": "GitHub CLI token"
    },
    "GITHUB_TOKEN": {
      "dotenv": "all",
      "tokenPriority": 1,
      "description": "GitHub Actions token"
    },
    "OCTOCODE_GITHUB_CLIENT_ID": {
      "dotenv": "home",
      "configSource": true,
      "description": "GitHub OAuth client override"
    },
    "OCTOCODE_HOME": {
      "documentation": true,
      "dotenv": "never",
      "description": "Overrides the Octocode configuration directory (default: <os-home>/.octocode)"
    },
    "OCTOCODE_AST_REWRITE_STATE_DIR": {
      "documentation": true,
      "dotenv": "home",
      "description": "Override the astRewrite transaction/recovery state directory."
    },
    "OCTOCODE_CARGO": {
      "documentation": true,
      "dotenv": "home",
      "description": "Override the cargo executable used for Rust dependency-graph analysis."
    }
  },
  "removed": {
    "settings": {
      "version": "The configuration file no longer declares a schema version; delete the key.",
      "classification.type": "The classification provider is built in; delete the key.",
      "network.timeout": "Request timeout is fixed at 30 s; delete the key.",
      "network.maxRetries": "Retries are fixed at 3; delete the key.",
      "network.maxRateLimitWait": "The GitHub rate-limit wait is fixed at 45 s; delete the key.",
      "lsp.maxMemoryMb": "The language-server memory cap is host-derived (25% of RAM, 4096–8192 MiB); set maxMemoryMb per server in lsp-servers.json instead, and delete the key.",
      "output.pagination": "The automatic response page is fixed at 20,000 characters; pass responseLength per call instead, and delete the section.",
      "storage.cloneCache": "The clone cache is fixed at a 24 h TTL, 2 GiB and 50 repositories; delete the section.",
      "classification.maxConcurrency": "Classification concurrency is fixed at 10 in-flight requests per endpoint; delete the key.",
      "classification.maxCandidates": "Context selection is fixed at 64 candidates per operation; delete the key.",
      "classification.maxChars": "Context selection is fixed at 131,072 characters per operation; delete the key.",
      "classification.timeoutMs": "The context selection deadline is fixed at 10 s; delete the key."
    },
    "environment": {
      "OCTOCODE_CLASSIFICATION_TYPE": "The classification provider is built in; unset the variable.",
      "REQUEST_TIMEOUT": "Request timeout is fixed at 30 s; unset the variable.",
      "MAX_RETRIES": "Retries are fixed at 3; unset the variable.",
      "OCTOCODE_MAX_RATE_LIMIT_WAIT": "The GitHub rate-limit wait is fixed at 45 s; unset the variable.",
      "OCTOCODE_LSP_MAX_MEMORY_MB": "The language-server memory cap is host-derived (25% of RAM, 4096–8192 MiB); set maxMemoryMb per server in lsp-servers.json instead, and unset the variable.",
      "OCTOCODE_OUTPUT_DEFAULT_CHAR_LENGTH": "The automatic response page is fixed at 20,000 characters; pass responseLength per call instead, and unset the variable.",
      "OCTOCODE_CACHE_TTL_MS": "The clone cache TTL is fixed at 24 h; unset the variable.",
      "OCTOCODE_MAX_CACHE_SIZE": "The clone cache size is fixed at 2 GiB; unset the variable.",
      "OCTOCODE_MAX_CLONES": "The clone cache keeps at most 50 repositories; unset the variable.",
      "OCTOCODE_CLASSIFICATION_CONCURRENCY": "Classification concurrency is fixed at 10 in-flight requests per endpoint; unset the variable.",
      "OCTOCODE_CLASSIFICATION_MAX_CANDIDATES": "Context selection is fixed at 64 candidates per operation; unset the variable.",
      "OCTOCODE_CLASSIFICATION_MAX_CHARS": "Context selection is fixed at 131,072 characters per operation; unset the variable.",
      "OCTOCODE_CLASSIFICATION_TIMEOUT_MS": "The context selection deadline is fixed at 10 s; unset the variable."
    }
  },
  "sections": {
    "": {
      "title": "Configuration",
      "file": true,
      "resolved": true,
      "fields": {}
    },
    "github": {
      "title": "GitHub API",
      "typeName": "GitHub",
      "file": true,
      "resolved": true,
      "fields": {
        "apiUrl": {
          "type": "url",
          "default": "https://api.github.com",
          "description": "GitHub REST API root. GitHub Enterprise commonly uses /api/v3.",
          "env": {
            "name": "GITHUB_API_URL",
            "dotenv": "home",
            "normalize": "trim"
          }
        },
        "graphqlEnabled": {
          "type": "boolean",
          "default": true,
          "description": "Use GitHub GraphQL where supported; false forces REST-only access.",
          "env": {
            "name": "OCTOCODE_GITHUB_GRAPHQL"
          }
        }
      }
    },
    "local": {
      "title": "Local tools",
      "file": true,
      "resolved": true,
      "fields": {
        "enabled": {
          "type": "boolean",
          "default": true,
          "description": "Enable local filesystem tools on every runtime surface.",
          "env": {
            "name": "OCTOCODE_ENABLE_LOCAL",
            "dotenv": "home",
            "workspaceNarrowsTo": "false"
          }
        },
        "beta": {
          "type": "boolean",
          "default": false,
          "description": "Enable beta features and tools; off by default on every surface. `octocode schema` reports which tools the gate withholds.",
          "env": {
            "name": "OCTOCODE_BETA",
            "dotenv": "home"
          }
        },
        "allowedPaths": {
          "type": "stringArray",
          "default": [],
          "itemFormat": "path",
          "description": "Extra absolute or home-relative roots added to the allowed roots (workspace root and OCTOCODE_HOME).",
          "env": {
            "name": "ALLOWED_PATHS",
            "dotenv": "home"
          },
          "notes": "The environment value is a comma-separated list."
        },
        "workspaceRoot": {
          "type": "path",
          "default": null,
          "displayDefault": "process.cwd()",
          "description": "Optional absolute or home-relative workspace root.",
          "env": {
            "name": "WORKSPACE_ROOT",
            "dotenv": "home",
            "normalize": "trim"
          }
        }
      }
    },
    "tools": {
      "title": "Tool availability",
      "file": true,
      "resolved": true,
      "fields": {
        "enabled": {
          "type": "stringArray",
          "default": null,
          "description": "Strict tool allowlist replacing the default tool set.",
          "env": {
            "name": "TOOLS_TO_RUN"
          }
        },
        "disabled": {
          "type": "stringArray",
          "default": null,
          "description": "Tools removed from the default tool set.",
          "env": {
            "name": "DISABLE_TOOLS"
          }
        }
      }
    },
    "mcp": {
      "title": "MCP presentation",
      "file": true,
      "resolved": true,
      "fields": {
        "deferred": {
          "type": "stringArray",
          "default": null,
          "description": "Available tools left out of tools/list; one run({tool, query}) tool executes them and next/hints leads that name them.",
          "env": {
            "name": "OCTOCODE_DEFER_TOOLS"
          }
        }
      }
    },
    "network": {
      "title": "Network",
      "file": true,
      "resolved": true,
      "fields": {
        "allowPrivateRegistry": {
          "type": "boolean",
          "default": false,
          "description": "Allow private, loopback, or link-local artifact registries.",
          "env": {
            "name": "OCTOCODE_ALLOW_PRIVATE_REGISTRY",
            "dotenv": "home"
          },
          "notes": "Security-sensitive SSRF escape hatch; opt in only for trusted enterprise registries."
        }
      }
    },
    "lsp": {
      "title": "LSP",
      "file": true,
      "resolved": true,
      "fields": {
        "configPath": {
          "type": "path",
          "default": null,
          "description": "Optional path to a custom lsp-servers.json.",
          "env": {
            "name": "OCTOCODE_LSP_CONFIG",
            "dotenv": "home",
            "normalize": "trim"
          }
        },
        "autoInstall": {
          "type": "enum",
          "values": [
            "prompt",
            "off",
            "auto"
          ],
          "description": "Whether `octocode lsp-server install` may download a managed language server: prompt (ask), off, or auto.",
          "env": {
            "name": "OCTOCODE_LSP_AUTO_INSTALL",
            "dotenv": "home",
            "normalize": "lower"
          }
        },
        "cacheDir": {
          "type": "path",
          "default": null,
          "description": "Directory for managed language-server installs; default <octocode home>/lsp.",
          "env": {
            "name": "OCTOCODE_LSP_CACHE_DIR",
            "dotenv": "home",